{"bundleVerifiedAfter":true,"bundleVerifiedBefore":true,"candidateImplementationUsed":false,"cases":[{"caseDigest":"sha256:4b9948140809d01d61ed986f7f5a749ac01d1589ea30370af7aa8170473433b9","caseId":"multi-table","catalogCount":2,"catalogs":[{"candidates":[{"formatSignatures":[],"formatting":[],"id":"region-001","kinds":["all-observation-panels","repeated-observation-panels"],"nonblankCount":8,"roleHints":["observations"],"sample":["R4C3=100","R4C4=110","R5C3=90","R5C4=95","R11C3=7"],"segments":["R4C3:R5C4","R11C3:R12C4"],"selectedCellCount":8,"valueLikeCount":8},{"formatSignatures":[],"formatting":[],"id":"region-002","kinds":["observation-panel"],"nonblankCount":4,"roleHints":["observations"],"sample":["R4C3=100","R4C4=110","R5C3=90","R5C4=95"],"segments":["R4C3:R5C4"],"selectedCellCount":4,"valueLikeCount":4},{"formatSignatures":[],"formatting":[],"id":"region-003","kinds":["observation-panel"],"nonblankCount":4,"roleHints":["observations"],"sample":["R11C3=7","R11C4=8","R12C3=4","R12C4=6"],"segments":["R11C3:R12C4"],"selectedCellCount":4,"valueLikeCount":4},{"formatSignatures":[],"formatting":[],"id":"region-004","kinds":["top-header-level-group"],"nonblankCount":4,"roleHints":["direct-column-candidate"],"sample":["R3C3=\"2023\"","R3C4=\"2024\"","R10C3=\"Jan\"","R10C4=\"Feb\""],"segments":["R3C3:R3C4","R10C3:R10C4"],"selectedCellCount":4,"valueLikeCount":2},{"formatSignatures":[],"formatting":[],"id":"region-005","kinds":["direct-row-projection-group"],"nonblankCount":4,"roleHints":["direct-row-candidate"],"sample":["R4C2=\"NSW\"","R5C2=\"VIC\"","R11C2=\"Widget\"","R12C2=\"Gadget\""],"segments":["R4C2:R5C2","R11C2:R12C2"],"selectedCellCount":4,"valueLikeCount":0},{"formatSignatures":[],"formatting":[],"id":"region-006","kinds":["preceding-panel-anchor-group"],"nonblankCount":2,"roleHints":["cascading-row-candidate"],"sample":["R3C2=\"State\"","R10C2=\"Product\""],"segments":["R3C2:R3C2","R10C2:R10C2"],"selectedCellCount":2,"valueLikeCount":0}],"cellDataFactCount":22,"formatFactCount":0,"observationPanelCount":2,"omittedCandidateCount":0,"sheet":"Mixed","version":"semantic-region-catalog-v5-adjacent-year-aware"},{"candidates":[],"cellDataFactCount":2,"formatFactCount":0,"observationPanelCount":0,"omittedCandidateCount":0,"sheet":"Readme","version":"semantic-region-catalog-v5-adjacent-year-aware"}],"workbookContentDigest":"sha256:e89b640950be64cabe90bc71c69d0a7ce664193873e483064165ecc2f8355164","workbookRelativePath":"fixtures/workbooks/multi-table.xlsx"},{"caseDigest":"sha256:2ebac7e7b8221f8f44791a018be33bbe737358476510381839200b652e0e4853","caseId":"simple-crosstab","catalogCount":1,"catalogs":[{"candidates":[{"formatSignatures":[],"formatting":[],"id":"region-001","kinds":["observation-panel"],"nonblankCount":4,"roleHints":["observations"],"sample":["R3C3=123","R3C4=0.52","R4C3=98","R4C4=0.48"],"segments":["R3C3:R4C4"],"selectedCellCount":4,"valueLikeCount":4},{"formatSignatures":[],"formatting":[],"id":"region-002","kinds":["top-header-level-group"],"nonblankCount":2,"roleHints":["direct-column-candidate"],"sample":["R2C3=\"Count\"","R2C4=\"Rate\""],"segments":["R2C3:R2C4"],"selectedCellCount":2,"valueLikeCount":0},{"formatSignatures":[],"formatting":[],"id":"region-003","kinds":["direct-row-projection-group"],"nonblankCount":2,"roleHints":["direct-row-candidate"],"sample":["R3C2=\"NSW\"","R4C2=\"VIC\""],"segments":["R3C2:R4C2"],"selectedCellCount":2,"valueLikeCount":0},{"formatSignatures":["b|s14"],"formatting":["bold,font-size=14"],"id":"region-004","kinds":["preceding-panel-anchor-group","format-header-group"],"nonblankCount":1,"roleHints":["cascading-row-candidate","header-format-candidate"],"sample":["R1C1=\"Population counts\""],"segments":["R1C1:R1C1"],"selectedCellCount":1,"valueLikeCount":0}],"cellDataFactCount":10,"formatFactCount":1,"observationPanelCount":1,"omittedCandidateCount":0,"sheet":"Population","version":"semantic-region-catalog-v5-adjacent-year-aware"}],"workbookContentDigest":"sha256:7453482b08710e46d97868aed317359fcd06303698f96e021c4a4d2f52ece85a","workbookRelativePath":"fixtures/workbooks/simple-crosstab.xlsx"},{"caseDigest":"sha256:ad4e83ac05109f3fbcfb8b34c4f996c1d778da62955c41c7b4d14d06fb28b4ea","caseId":"sparse-headers","catalogCount":1,"catalogs":[{"candidates":[{"formatSignatures":[],"formatting":[],"id":"region-001","kinds":["observation-panel"],"nonblankCount":16,"roleHints":["observations"],"sample":["R3C2=10","R3C3=11","R3C4=12","R3C5=13","R4C2=14"],"segments":["R3C2:R6C5"],"selectedCellCount":16,"valueLikeCount":16},{"formatSignatures":[],"formatting":[],"id":"region-002","kinds":["top-header-level-group"],"nonblankCount":2,"roleHints":["direct-column-candidate"],"sample":["R2C2=\"Q1\"","R2C4=\"Q2\""],"segments":["R2C2:R2C2","R2C4:R2C4"],"selectedCellCount":2,"valueLikeCount":0},{"formatSignatures":[],"formatting":[],"id":"region-003","kinds":["direct-row-projection-group"],"nonblankCount":2,"roleHints":["direct-row-candidate"],"sample":["R3C1=\"North\"","R5C1=\"South\""],"segments":["R3C1:R3C1","R5C1:R5C1"],"selectedCellCount":2,"valueLikeCount":0},{"formatSignatures":[],"formatting":[],"id":"region-004","kinds":["preceding-panel-anchor-group"],"nonblankCount":1,"roleHints":["cascading-row-candidate"],"sample":["R1C1=\"Quarterly revenue by region\""],"segments":["R1C1:R1C1"],"selectedCellCount":1,"valueLikeCount":0}],"cellDataFactCount":22,"formatFactCount":0,"observationPanelCount":1,"omittedCandidateCount":0,"sheet":"Revenue","version":"semantic-region-catalog-v5-adjacent-year-aware"}],"workbookContentDigest":"sha256:9cf91a692ba65c0488a8b078aa4d95206717db7e7dc12409909b347a3784d878","workbookRelativePath":"fixtures/workbooks/sparse-headers.xlsx"}],"catalogContract":{"maxCandidates":160,"version":"semantic-region-catalog-v5-adjacent-year-aware"},"closureManifestDigest":"sha256:3ac83cc30cedc9edcf2f68b31c51297a914c755e117ee2b3887f5c90abd7de17","copyCommitDigest":"sha256:579ca12438a6a0a89bbf54fdbb7d9c2b4f506db9c98a5f65e9d8697192e92799","harnessDigest":"sha256:c054e3cead48cc62f3b497cbb0c9ffb1e8526dac273399c603e1894cb6e4e3c6","independentReview":false,"limitations":["This is a historical-source role-aware region-catalog reference generated under implementing-agent self-review.","The reference uses Tidy Dagster's locked node_modules rather than installing the copied full lockfile.","Candidate parity and independent review are recorded separately."],"networkIsolationEnforced":true,"parityEstablished":false,"recordedAt":"2026-08-12T03:50:00Z","referenceDigest":"sha256:7632516d91c47855105d72b072df7368bf67b2167c0e74a4ab4833f6b5a954df","referenceKind":"role-aware-semantic-region-catalog","relocated":true,"runtime":{"copiedSourceLockDigest":"sha256:cddcf7bf8b871a9a5f1a5c89229e8a714893c4caedfa5a1476d823b991fc4288","dependencyRuntime":"tidy-dagster-locked-node-modules","nodeVersion":"v24.7.0","tidyDagsterLockDigest":"sha256:72672d33a6d39b16a333c8740d3b9129f6209cabbdb9732a504251031be2eeeb","tsxVersion":"4.21.0"},"runtimeSiblingDependencyUsed":false,"schemaVersion":"tidy.historical-source-region-catalog-reference/v1","sourceTreeDigestAfter":"sha256:943db93919494c18c8489bfaa0142f6e1ed781d09b1144ad451a71dac7dab2fc","sourceTreeDigestBefore":"sha256:943db93919494c18c8489bfaa0142f6e1ed781d09b1144ad451a71dac7dab2fc"}
